general-only,survey-response,race,district,full-name,last-name,dob,,residence,party,education,background,web,social-fb,social-tw,headshot,a1,a2,a3,a4,a5,a6,q1,q2,q3,q4,q5,q6,sn1,sn2,sn3,sn4,sn5,sn6
,YES,harford-county/council-president,,"Frank ""Bud"" Hines",Hines,,,Fallston,Democratic,B.S. in Business Administration from Towson University with Concentrations in Accounting and Finance.,"I have 33 years of IT Technology Experience starting as a systems engineer trainee with EDS to finishing up as a VP.  As the VP of Technology, I led the IT group for a technology start-up that was acquired by ADP and later spun off to a company called  Broadridge Financial Solutions.   I had a team of 126  team members in Maryland,  Massachusetts, New York and India. I ran a budget of over 20M. Our clients were a Who's Who of the top 40 clients in the Retirement Marketing Industry.  When I left Broadridge Financial Solutions, my wife and I started an online site to assist people in recovery from heroin and opioid addiction called Quit The Habit or https://QuitTheHabit.org. I worked with Linda Williams from the Addictions Resource Council. She put me in touch with Joe Ryan from the Harford County Office of Drug Control Policy. They sent my wife and me to a five-day recovery coach academy training to help us hone the language on our site.",https://voteforbudhines.com,,,http://surveygizmoresponseuploads.s3.amazonaws.com/fileuploads/296249/4299906/191-6c5351c135e6f8ca3d9491c6ac0094b4_Bud_Hines_small.jpg,"Barry Glassman and his team are to be commended for their successes in fighting the opioid crisis. They are at the forefront of fighting this disease and are a role model for the rest of the country.  I think Mr. Glassman inherited a large number of fiscal problems that he has just now been able to turn around. He is actively working to raise the pay of teachers, law enforcement, and other critical Harford County employees.  I am a Democrat and I am a fan of Barry Glassman. He is friendly, approachable,  has good common sense and is a fiscally smart steward of the finances of this county.","No. Even though I am a fan of Mr. Glassman's, I believe, as does he, that we need to do better with our funding of Education.   Our teachers are our heroes. They do the most important work that can be done for any of us - they teach our children and provide them with an education that can make or break them the rest of their lives.  Yet, our teachers do not make the equivalent of other professional salaries. What is worse, many of the teachers in Harford County are leaving and getting jobs as teachers in neighboring counties. We have to act swiftly to keep our teachers. We must raise their pay, fund their pensions and provide them with the resources they need to do their jobs.   Our members of law enforcement have been dealing with low salaries compared to adjoining counties. We must raise their pay to keep them here in Harford County. We can not afford a brain drain from our teachers or our law enforcement officers.","I am running for the office of Harford County Council President because I have been disappointed with the way Harford County handles zoning and the lack of support it gives is citizens in regards to zoning issues.   When David Craig was our County Executive, I had a fight with my next door neighbor who happens to be Jones Subaru. Jones acquired the former Hinder Car dealership that sat dormant for several years. Jones tore down trees between our property (buffer area and part of a utility easement), expanded their building, and tripled the size of their parking lot. All of this was done without filing a single permit. They were ""grandfathered in""??? Then they erected stadium lighting that per our lighting expert (used in court)  stated the lighting was the equivalent of 3 football/baseball stadiums.  We contacted our councilman for District B, Joe Woods, initial concern but then no help. Contacted Harford County Zoning. No help. They are grandfathered in.....  Contacted Jones Subaru. No help. They laughed at us. Contacted BG&E - no help. We have a contract with Jones.  Contacted David Craig who was driving a brand new Jones truck - no help.   It took 2 years and 60k in legal fees to get some of that lighting subdued.   I think that Harford County Zoning meetings should be open and transparent and filmed. No decisions should be made behind closed doors.  All of the affected community groups must be represented and present for the decision- making process.","I think the county is doing a superb job of fighting the opioid epidemic. They are activiely training recovery coaches, holding a variety to training seminars, conducting plays, etc.  I would like to see more people who are trained in recovery, be required to provide some type of volunteer service to give back to the community. Most of the people who work in this field are just too emotionally drained to give more at the end of their day.  So, I encourage training people outside of the field.  What else can Harford County do? Provide training to students (do not give this task to teachers) on how to cope with the terrible issues we face in life such as being ugly, called fat, stupid, etc. How to deal with rejection and life's ills. This is what causes people to turn to drugs. We must teach coping skiils. This will help with addiction and violence.   I am going to be self serving here. I was helped with a 40 plus year smokeless tobacco addiction by an online site called http://killthecan.org. I started Quit The Habit to provide the same type of recovery support to help people quitting heroin and opioid addiction. I want my site to be the hub for people in recovery, anywhere in the nation to come and get and give support.   We should train more recovery coaches and get them to my site to help the public.  It is self funded and free.","I think that the Sherff's Office is held in high regard.  I met one of the captains in their force at a recent Edgewood town meeting and was quite impressed, even though he was from New York:). My parents are from New York.  If other captains visit their local town halls and are open to discussions with members in the community as this captain did, then I believe the county is well served. He said contact him any time for any reason. He agreed to serve as escalation point. I was very impressed.   I would like to see less serious treatment of youth with drug offenses. I think sending them to jail or juvenile facilities will make things worse and lead them to a life of crime and drugs. I would like to find opportunities for them to get training, a big brother or sister to guide them to a better path. Many of these youth may have been raised in troubled households.... Let's see if we can get them an apprenticeship or some other opportunites.  We have an opportunity to turn these youth around...","After seeing this question, I researched this topic.  I would encourage Harford County to not move the volunteer fire and emergency medical services out-of-the-way but instead, to incorporate them into their plan.  Make these wonderful volunteers who have so nobly served this county full time Harford County employees and phase in the assumption of these fire deparmentments and EMSs in a thoughtful and caring way.  Only after including our volunteers, should we then seek to expand and hire new staff.  But, we must take care of our volunteers first.",What do you consider the greatest accomplishments and failings of the Glassman administration?,"Does Harford County have adequate resources to meet its needs, particularly in the funding of public schools and law enforcement?",Have the county’s land use policies adequately balanced growth and the preservation of existing communities and agricultural land?,"How do you rate the county’s efforts to fight opioid addiction overdoses? What else, if anything, should the county be doing to combat the epidemic?",How would you characterize the relationship between the Harford County Sheriff’s Office and the communities it serves? Are any reforms necessary?,The Glassman administration is trying to lead Harford County’s formerly all-volunteer fire and emergency medical services to more a professional organization with more paid personnel. How do you rate the county’s effort and what should have or could have done differently in this controversial transformation?,Glassman record,Taxes,Land use,Opioids,Sherrif's office,Fire/EMS
,YES,harford-county/county-council,F,Amy Altmann Jahnigen,Jahnigen,5/18/1977,,Bel Air,Republican,I grew up in Harford County and graduated from C Milton Wright High School.  From there I matriculated to UMBC where I graduated with honors as a student-athlete with a double major in Economics and Computer Information Systems and a minor in Finance.,I am a Senior Technology Engineer with FICO.  I have been with them for over 20 years.  I started as an intern in college and then joined full time after I graduated.  I was selected to represent FICO at the Women in Technology Summit in Silicon Valley in 2016.  I have also presented at conferences in Miami and Las Vegas speaking on best practices in Business Intelligence and Data Analytics.,http://www.amyjahnigen.com,VoteAmyJahnigen,,http://surveygizmoresponseuploads.s3.amazonaws.com/fileuploads/296249/4299906/191-3f232602e1c2f43ffbc1b2fdaf3b181e_IMG_2210ed-_fav.jpg,"I commend the Glassman Administration for all their hard work and efforts to make Harford County a great place to live, work and raise a family.  I am glad that the administration was able to give long overdue pay raises to teachers.  I also am glad that his administration has worked to develop online communication tools and apps for convenient access to information.   Some areas of focus I would like to see are: Advocacy for more state funding for Harford County Public Schools, we are ranked 23 out of 24 public school systems in Maryland in terms of per pupil funding, and with the pending closing of Union Memorial Hospital in Havre de Grace, we need to advocate for a full service hospital replacement.   Our county continues to grow and would greatly benefit from two full service hospitals to care for our residents.","No, we need more funding to keep good teachers and police officers.   We are losing great teachers to surrounding counties because the pay is better.  We need to continue to increase teacher salaries to keep our amazing Harford County Teachers.  We need to grow our law enforcement in the county to help combat the issues with the Opioid Crisis. Sheriff Gahler and his team have done an amazing job keeping our county safe, but with more funding they could do more to ensure safety for everyone.   We also have a lot of aging school facilities and we need to work to update them to be safer and more up to date for our youth.","In some cases yes, in others no. Harford County is a great mix of thriving communities and agricultural land; we need to keep it that way.  I was born and raised in Harford County and have always appreciated its agricultural heritage.  Development and growth are good for the county but we have to be proactive about land use instead of reactive and we need to make sure when Community Input meetings are held that the community input is taken into account when making approval decisions.  I am a proponent of SMART Development.  By that I mean, we need to build in the required infrastructure prior to developing. This means creating the necessary roads and improvements to minimize impacts on traffic, safety and access to local businesses during and after development.   The county needs to look at alternative ways to keep roads open while doing construction so that building something like a roundabout does not cause undue hardship to small businesses while construction is going on.  Cecil and Baltimore Counties have done this successfully, Harford needs to follow suit.",It is sad to see the overdoses and death numbers rise.  I think awareness is important and making sure the stigma of addiction is removed – it crosses all socio-economic groups.  We need to stop the cycle of despair.  Public awareness and drug take back days need to increase and we need to do more to teach our youth about the dangers of opioids and other gateway drugs.,"Sheriff Gahler and his staff have done a fantastic job of protecting Harford County.  I will never forget the day the 2 deputies that gave the ultimate sacrifice protecting local citizens in the Abingdon Panera, as it was my twins 8th birthday.  Those men are heroes as are the men and women that put on a uniform every day to protect our county.  I think there is a very healthy relationship and one of mutual respect between the Sheriff's Office and the communities they serve. We need to continue to assess day to day the needs of our citizens and keep them safe.","The county has two paid ambulances in service and I think that it is a fantastic idea to have paid paramedics in the county. We have trained, dedicated citizens that are going to other municipalities to serve so that they can support their family by getting a salary and benefits.  Having paid positions will keep the talent here in the county and will be a great partnership with the volunteers that we have.",What do you consider the greatest accomplishments and failings of the Glassman administration?,"Does Harford County have adequate resources to meet its needs, particularly in the funding of public schools and law enforcement?",Have the county’s land use policies adequately balanced growth and the preservation of existing communities and agricultural land?,"How do you rate the county’s efforts to fight opioid addiction overdoses? What else, if anything, should the county be doing to combat the epidemic?",How would you characterize the relationship between the Harford County Sheriff’s Office and the communities it serves? Are any reforms necessary?,The Glassman administration is trying to lead Harford County’s formerly all-volunteer fire and emergency medical services to more a professional organization with more paid personnel. How do you rate the county’s effort and what should have or could have done differently in this controversial transformation?,Glassman record,Taxes,Land use,Opioids,Sherrif's office,Fire/EMS
,NO,harford-county/county-council,A,Andre V. Johnson,Johnson,,,,Democratic,,,,ElectAndreJohnson,ElectAVJ,,,,,,,,,,,,,,Glassman record,Taxes,Land use,Opioids,Sherrif's office,Fire/EMS
,YES,harford-county/county-council,E,Bridgette Johnson,Johnson,,,Churchville,Democratic,"B.A. with a concentration in Government and International Relations from the University of South Carolina. Master of Planning from the University of Maryland, College Park.",I have been working in the field of economic development for the last 16 years.,http://www.johnsonforharford.com,BridgetteJohnsonForHarford,,http://surveygizmoresponseuploads.s3.amazonaws.com/fileuploads/296249/4299906/95-08b31289c4e32ac5fb3ad14f1e42577d_5609-_Bridgette_Johnson.jpg,"The administration has achieved success with its Green Initiatives and continuation of the Agricultural Preservation Program.  Allocating resources in the amount of $1.2 million for a school resource officer in each middle school and providing funding for additional security measures in all county public schools provides an extra layer of protection for our children. The public relations, marketing materials and videos promoting Harford County are consistently released to the public.  The deterioration and devaluation of the Rt.40 Corridor didn't start under the current administration and it hasn't improved under the current administration.  The Rt. 40 corridor is a major commercial area located within the development envelope. The redevelopment of the corridor is vital to future economic and business growth in Harford County. To spur interest and investment in the redevelopment of the Rt. 40 corridor the public sector (government) will need to have vision, flexibility and creative incentive packages.  Tourism/Hotel Occupancy Tax – Harford County Bill No. 14-035 - Revise the current legislation to redefine or eliminate the ""tourism and/or tourism related activities"" as a qualifier for the Hotel Occupancy Tax Bill. Transparency is needed to track all of the revenue collected including the portion not awarded to non-profits and municipalities. Ensure the communities located outside of the municipalities receive a dedicated percentage of the hotel tax collected in their respective areas to be used towards community and economic development improvement projects. Support a designated percentage of the hotel tax to be annually allocated to the Visit Harford organization.","Yes, Harford County has adequate resources to meet the needs of funding public schools and law enforcement.  The goal should be to utilize the resources effectively and responsibly while increasing the tax base through economic development and smart growth. As the overall tax base increases the resources available for public schools, law enforcement, county employees, road improvements, snow removal and other public services increases.","Over the past three years, Harford County has experienced very little growth in terms of redevelopment and new development projects.  Business attraction and retention have been stagnant in Harford County as two big economic development and employment deals went to a neighboring county.; Lidl, a German supermarket chain and an Amazon distribution center both located in Cecil County.  Additionally, Medline Industries is moving from its current location in Harford County to Principio Business Park in Cecil County nearly tripling the company's workforce and adding 200 new jobs.  The Proposed Fiscal Year 2019 Operating Budget has record-level funding of $22 million from revenue dedicated to preserving agricultural land.  Preserving open space and agricultural land increases the quality of life for residents of Harford County. However, there are neighborhoods and communities within the county in need of investment, development and redevelopment projects t to increase the quality of life and living standards.",The Harford County Department of Community Services and the Office of Drug Control Policy are doing a good job with its efforts to educate and combat the opioid addiction epidemic. The Department of Community Services offers a wide array of services to residents and does an outstanding job of communicating through public relations and media campaigns.  The opioid epidemic is a national crisis and Harford County has done a satisfactory job in trying to combat the crisis.,There is always room for improvement between law enforcement and the community they serve.  Establishing a relationship with members of a community or a particular neighborhood is essential for the purpose of preserving the peace and creating trust between officers and residents.   Recruiting and hiring law enforcement officers that live in the communities they police as well as sharing similar backgrounds and experiences increases the opportunities for successful partnerships and relationships.,The successful Fire & EMS Association should always have a voice and a seat at the table when decisions are made about the particulars of the Emergency Medical Response System in Harford County. The transition is still fairly new and will need to be observed and evaluated by measurable and quantifiable results over the coming years.,What do you consider the greatest accomplishments and failings of the Glassman administration?,"Does Harford County have adequate resources to meet its needs, particularly in the funding of public schools and law enforcement?",Have the county’s land use policies adequately balanced growth and the preservation of existing communities and agricultural land?,"How do you rate the county’s efforts to fight opioid addiction overdoses? What else, if anything, should the county be doing to combat the epidemic?",How would you characterize the relationship between the Harford County Sheriff’s Office and the communities it serves? Are any reforms necessary?,The Glassman administration is trying to lead Harford County’s formerly all-volunteer fire and emergency medical services to more a professional organization with more paid personnel. How do you rate the county’s effort and what should have or could have done differently in this controversial transformation?,Glassman record,Taxes,Land use,Opioids,Sherrif's office,Fire/EMS
,NO,harford-county/council-president,,Shawn A. Kingston,Kingston,,,,Republican,,,,,,,,,,,,,,,,,,,Glassman record,Taxes,Land use,Opioids,Sherrif's office,Fire/EMS
,NO,harford-county/county-council,C,Karen Kukurin,Kukurin,,,,Democratic,,,http://www.kukurin4districtc.com,,,,,,,,,,,,,,,,Glassman record,Taxes,Land use,Opioids,Sherrif's office,Fire/EMS
,NO,harford-county/county-council,A,Paula R. Mullis,Mullis,,,,Republican,,,,,,,,,,,,,,,,,,,Glassman record,Taxes,Land use,Opioids,Sherrif's office,Fire/EMS
,YES,harford-county/county-council,B,Suzanne Oshinsky,Oshinsky,,,Bel Air,Democratic,"I received my B.A. from Columbia University in Asian and Middle Eastern Cultures,  with a minor in Environmental Science,  and was chosen to be a Centenniel Scholar.  I completed my M.A. in Near Eastern Studies at UC Berkeley.","I have worked as an educator, as well as being a writer and editor for several in print and online publications. I am also a mom to two kids with special needs, one of whom I homeschool, who have been my chief occupation.",,,,http://surveygizmoresponseuploads.s3.amazonaws.com/fileuploads/296249/4299906/99-bf607f61836e33b08f78a33b45b82d0e_mommy1a.png,"I appreciate that Glassman's administration has begun to bring more awareness to  mental health issues. However, local mental health resources are still inadequate. We also need to be concerned that Glassman was very quickly able to find $1.5 million in the budget for SRO officers to be placed in our schools, but has underfunded teacher's salaries in Harford County year after year.","Harford County has consistently declined to fully fund public education, which has led to stagnant salaries, causing some of our best and most experienced teachers to leave for other counties. I know from my own experience that children with special needs are falling through cracks. Meanwhile, all children would benefit from smaller classroom sizes, experienced, well-trained and respected teachers,  and programs to meet a variety of needs.","I am concerned that development and zoning changes have occured haphazardly, without input from the people in the communities and farm families affected by growth.  Current land use policy has already created traffic issues and has done little to spread resources equitably throughout all parts of Harford County.","The county has been very active in fighting the opiod epidemic from a law enforcement perspective. However, we are severely lacking in mental health care resources, as well as support for families struggling with mental health and other related issues, such as disability. In particular, there is a dearth of  pediatric psychiatrists and therapists, and the few practices available locally often do not take health insurance, causing families to have a difficult time obtaining regular, consistent care.","I believe there is generally a positive relationship between the Harford County Sheriff's Office and the communities it serves.  I do feel that the Sheriff's office would do well to adopt a community policing strategy, allowing police officers to be part of and familiar with the local community they serve.  I would also like to see more opportunities for members of the community with special needs to develop positive, constructive relationships with law enforcement.",I appreciate Glassman's efforts to ensure that our fire and emergency medical needs are adequately met.,What do you consider the greatest accomplishments and failings of the Glassman administration?,"Does Harford County have adequate resources to meet its needs, particularly in the funding of public schools and law enforcement?",Have the county’s land use policies adequately balanced growth and the preservation of existing communities and agricultural land?,"How do you rate the county’s efforts to fight opioid addiction overdoses? What else, if anything, should the county be doing to combat the epidemic?",How would you characterize the relationship between the Harford County Sheriff’s Office and the communities it serves? Are any reforms necessary?,The Glassman administration is trying to lead Harford County’s formerly all-volunteer fire and emergency medical services to more a professional organization with more paid personnel. How do you rate the county’s effort and what should have or could have done differently in this controversial transformation?,Glassman record,Taxes,Land use,Opioids,Sherrif's office,Fire/EMS
,NO,harford-county/county-council,C,Patti Parker,Parker,,,,Republican,,,,ParkerforHarford,,,,,,,,,,,,,,,Glassman record,Taxes,Land use,Opioids,Sherrif's office,Fire/EMS
