general-only,survey-response,race,district,full-name,last-name,dob,,residence,party,education,background,web,social-fb,social-tw,headshot,a1,a2,a3,a4,a5,a6,q1,q2,q3,q4,q5,q6,sn1,sn2,sn3,sn4,sn5,sn6
,YES,harford-county/county-council,D,Chad R. Shrodes,Shrodes,12/28/1973,,White Hall,Republican,"I'm a lifelong resident of Norrisville, a father, a graduate of North Harford High School, Harford Community College and Towson University; and former land use planner for the County and State, currently serving a third term as Councilman. I have a BS in Land Use and Environmental Planning. My Council experience, planning background, understanding of sound planning practices, and level of local knowledge have been vital to the success of the council this term and in past terms. My experience will continue to be important as the next Council will include three or more new members.","In addition to my tenure on the Council, I have more than two decades of land use planning experience, with specific experience in the fields of transportation, the environment, and historic and agricultural land preservation. I have also worked as a Real Estate Agent for 11 years.  I am a graduate of the Maryland Academy for Excellence in Local Governance, the Harford County Leadership Academy, and the Harford County Sheriff's Office Citizens Police Academy.",http://www.chadshrodes.com,CouncilmanChadShrodes,,http://surveygizmoresponseuploads.s3.amazonaws.com/fileuploads/296249/4299906/95-d06f8370db09e06179c5542789b030eb__TS24618_MODIFIED.jpg,"I am proud to have supported the Administration's restoration of pay increases for law enforcement, teachers and Harford County Government employees, renewed investment in agricultural preservation, and new tax credits for seniors and veterans. Further, the Administration's efficiency initiatives have significantly increased the County's fund balance and contributed to the County's continued Triple A Bond Rating. This has been accomplished without raising taxes. I value the Administration's efforts to ""investment in people"", and support their efforts to address mental health crisis in Harford County and reduce homelessness. Further, I support the Administration's investments in public safety including the recent announcement of funding for student resource officers in Middle Schools. Moving forward I'd like to work with the County on improvements to public transportation and safety including additional support for first responders and student resource officers in elementary schools.","I am proud of the progress we have made including restoring salaries to teachers and first responders, while building the County's fund balance. I feel the County has met needs adequately without raising taxes. I support efforts to increase State funding for our schools, our highways, and public safety and the County's efforts to recover losses caused by the opiate epidemic, from pharmaceutical companies.","I believe that the County's land use policies have adequately balanced growth, while preserving productive agricultural and natural resources. The ""Development Envelope,"" has helped to direct new residential and commercial development into designated growth areas. Harford County is a leader in the country for land preservation programs; to date, Harford County has protected over 50,000 acres.  I was proud to have championed the expansion of the Maryland Rural Legacy Program and Priority Preservation Area (PPA) boundaries to include the ""Upper"" Deer Creek Watershed.  During my first term, I was instrumental in creating legislation that strengthened our County's already renowned land preservation easement program to encourage greater participation from prospective landowners.   Most recently, I was an advocate for the newly adopted land preservation incentive areas (productive farmland nearest to our designed growth areas under the greatest development pressure).  I look forward to working with the Administration to develop innovative ways to continue to balance growth, protect the character of our rural and village communities, and enhance the quality of life for all residents of Harford County.","Harford County is a leader in the State and the Country in pioneering initiatives to fight the opiate epidemic including award-winning awareness campaigns, arts programs, peer to peer messaging, peer recovery coaches, agency partnerships, and an outstanding prevention team- the Harford County Office of Drug Control Policy.  In 2017 the Office leveraged the County's investment of $250,000 into more than a $1 million dollars for treatment and recovery. We are also fortunate to have ACR, a nonprofit organization that offers 24/7 support for individuals seeking treatment, in our County. Harford County Government and its partners (Harford County Sheriff's Office, schools, hospitals, health department, Court System, CORE, etc.) have done a tremendous job raising awareness about the epidemic and are working daily to reduce the barriers to treatment and recovery. Moving forward, we must continue to work together to address gaps in our communities. We need treatment beds for youth, mental health interventions for middle and elementary school children, transitional/recovery housing, teen diversion and re-entry programs, and resources to support long-term sobriety. Further, we need to partner with the defense community to protect our first responders, and find more effective ways to detect fentanyl.","The Harford County Sheriff's Office has an excellent Community Policing Team which includes School Resource Officers in high schools and soon middle schools. The School SROs are trusted confidants for students and dedicated public servants. The HOPE Group, HOPE Trailer, and participation at events like Project Homeless Connect, Drug Take Back Events, and School Resource Fairs are well attended by all of our partners in law enforcement and I commend them for making community outreach a high priority. I support increasing positive interaction opportunities like these.","Harford County is fortunate to have exceptional volunteer fire and emergency medical services which play a critical role in protecting our community. I strongly support our first responders and I am grateful for their service. They have a difficult and dangerous job to do. I am an advocate for funding necessary renovations, protective gear, and efforts to improve the quality of life of our volunteer first responders.",What do you consider the greatest accomplishments and failings of the Glassman administration?,"Does Harford County have adequate resources to meet its needs, particularly in the funding of public schools and law enforcement?",Have the county’s land use policies adequately balanced growth and the preservation of existing communities and agricultural land?,"How do you rate the county’s efforts to fight opioid addiction overdoses? What else, if anything, should the county be doing to combat the epidemic?",How would you characterize the relationship between the Harford County Sheriff’s Office and the communities it serves? Are any reforms necessary?,The Glassman administration is trying to lead Harford County’s formerly all-volunteer fire and emergency medical services to more a professional organization with more paid personnel. How do you rate the county’s effort and what should have or could have done differently in this controversial transformation?,Glassman record,Taxes,Land use,Opioids,Sherrif's office,Fire/EMS
,YES,harford-county/council-president,,Patrick Vincenti,Vincenti,5/21/1954,,Churchville,Republican,Havre de Grace High School Class of 1972 Harford Leadership Academy Class of 2015 University of Maryland Academy of Excellence in Governance Class of 2017 University of Maryland EMT Class 1974,"Baker, Bel Air Bakery 1972-1986 Owner, Vincenti Decoys 1970 – Part time – -- Full Time 1986-Present Havre de Grace Decoy Museum 1989-Present  --Board President for 9 years Treasurer, R. Madison Mitchell Endowment Trust 1992-Present Member, Rotary Club of Aberdeen 2015-Present Member, Society of Italian-American Businessmen 2017 – Present",http://www.patrickvincenti.com,,,http://surveygizmoresponseuploads.s3.amazonaws.com/fileuploads/296249/4299906/44-1099e4c42f5151ab70ee938a032f3a2a_Pat_Vincenti%2C_District_E_Headshot.jpg,"The accomplishments of the Glassman Administration include restoring the fund balance to nearly $20 Million, reducing the debt and directing all new revenue and savings toward to salary increases for teachers, deputies, correctional officers and county workers after being flat funded for 6-7 years.  This current administration continues to be a strong advocate for public safety and our school system. This can be seen by the new Havre de Grace Middle/High School project and fencing off new revenue for special needs buses and technology for Harford County Public Schools. More recently, an additional $1.3 Million funding for additional School Resource Officers (SROs) has been announced for the FY19 Budget.  While the Glassman Administration continues to be fiscally responsible, in my opinion we have missed opportunities to reinvest and revitalize the Route 40 Corridor.","I'm proud to be a member of the current County Council which has approved the past three budgets of the Glassman Administration. These budgets have taken steps to correct the pay scales for our teachers and law enforcement. After being flat funded for 6-7 years, 85% of all new revenue and savings has gone for salary increases for our teachers, deputies and county workers.  Harford County has always met the Maintenance of Effort for our students but for the past 3 years, we have gone over and above. Along with this effort the county has been able to provide for funding for special needs buses and technology upgrades for our public schools, and more recently announced the funding for School Resource Officers in all middle schools across the county.","The purpose of Harford NEXT (Master Plan) was to address those concerns and needs while planning for smart growth and address areas such as mobility, rural communities, environmental stewardship, walking trails, and commercial development.  The Master Plan directs growth along our corridors where the infrastructure exists or can be enhanced while also allowing for open space and agricultural preservation. Harford County is within the top 10 nationally for agricultural land preservation with over 50,000 acres across the county preserved.","In Harford County we have many community partners and professionals working with the Glassman administration to combat the issue of opioid and heroin use from all angles and I remain dedicated to assist them in any way that I can. Among other tools, Harford County Health Department and the Office of Drug Control Policy are working to provide our citizens with education and prevention measures. Along with public outreach efforts, these departments have received approximately $500,000 in various funding to establish a crisis center equipped with overnight beds to assist residents of Harford County in fighting this epidemic.","I believe by the Harford County Sheriff's Office holding Public Outreach forums such as the Town Hall for School Public Safety and working with various groups and organizations is beneficial to our community and shows a positive relationship with the public. It works well when our County Executive, Sheriff, Municipal Law Enforcement agencies and School Superintendent and Community Leaders come together to answer questions and address concerns the public may have.","We appreciate the service our volunteers provide us each and every day. Any given night, they can be awakened at 2:00AM or 3:00AM to respond to the needs of our citizens. A great number of our volunteers have served Harford County for many years and they are aging.  In order to attract younger volunteers, we need to do more to assist our fire companies in their recruitment and retention efforts.  My understanding of the new County Medic units is that they exist to assist our volunteer companies in responding to the high call volumes they are receiving, especially during the work hours. In no way will this replace our volunteer service. Without our volunteers, the citizens of Harford County would need nearly $80 Million per year to fund a paid Fire and EMS service.",What do you consider the greatest accomplishments and failings of the Glassman administration?,"Does Harford County have adequate resources to meet its needs, particularly in the funding of public schools and law enforcement?",Have the county’s land use policies adequately balanced growth and the preservation of existing communities and agricultural land?,"How do you rate the county’s efforts to fight opioid addiction overdoses? What else, if anything, should the county be doing to combat the epidemic?",How would you characterize the relationship between the Harford County Sheriff’s Office and the communities it serves? Are any reforms necessary?,The Glassman administration is trying to lead Harford County’s formerly all-volunteer fire and emergency medical services to more a professional organization with more paid personnel. How do you rate the county’s effort and what should have or could have done differently in this controversial transformation?,Glassman record,Taxes,Land use,Opioids,Sherrif's office,Fire/EMS
,YES,harford-county/county-council,E,Robert S. Wagner,Wagner,7/1/1957,,Bel Air,Republican,Bel Air Sr. High School    1975 Harford Community College     1979  AA,Freight Brokerage   2013-2018 Harford County Council President 2002-2006 Harford County Council Dist. E    1990-2002 Wagner Farm LLC  2000-2004 Family Farm Mgr.   1980-2003,,,,http://surveygizmoresponseuploads.s3.amazonaws.com/fileuploads/296249/4299906/99-c0915080280447a626ab4d91d1ce80cd_IMG_1959.jpg,"The Glassman administration has maintained adequate funding for education and public safety during the past four years.  Our triple A bond rating has continued.  While well-intentioned, I do not believe the county's outsourcing efforts have actually realized the cost savings that were anticipated.   As prescribed by the charter, there needs to be a check and balance system between the legislative and executive branch.  The council has relinquished some of the needed authority to accomplish this.  Credit and blame are due both branches for accomplishments and failures. We, the citizens of the county achieve a better ""end product"" when the county government works as the charter called for.","Presently, I believe the county does have adequate resources to achieve meeting the needs of our public schools and law enforcement.  Future needs will require more manpower and funding as our population grows and needs increase and change.  Our drug and crime issues will demand more officers and correctional employees.  School funding will need more money to maintain a safe environment for our children.","Overall, our land use policies are balanced with preservation of existing communities and agricultural land.  The comprehensive land use plan sets the guidelines for this balance in our vision for the future.  I believe we can do better if we take a more extensive view of how we would like the county to grow and learn from our mistakes of the past. I have seen too many times, what was planned and approved takes on a whole new look upon completion. There were some issues in the past comprehensive review that I was not in agreement with, that were in contrast with the balance between existing communities and ag land usages. I would look forward to discussions of longer range planning and creating an environment here that provides job opportunities and a county that our children and grandchildren might want to continue to live and call ""home"".",I feel the Sheriff and County Executive have done a commendable job of addressing the opioid crisis.  This epidemic exploded much faster than anyone could have predicted and was prepared for.  Education and the revisiting of mental health and addiction programs will be needed to keep pace with the rising needs of our population that is affected by this.,"The Sheriff  and his office have done an excellent job addressing the community issues, being involved with various communities and identifying problem areas and taking appropriate action.   Presently, I am satisfied with the superior work that is being performed by this office.","This issue has been on and off the table for discussion for more than 25 years.  The volunteer service we enjoy has always performed an extraordinary job for Harford County throughout the years and continues to do so.  The expenses associated with any transformation to a more ""professional service"" will be astronomical.   Throughout the discussion and planning phases of this concept, I would have liked more transparency and public involvement. The growth in our county, the lack of available time people have for education and to volunteer for fire and emergency medical service are no doubt factors that make us look at options.  Transitioning will not be easy and it will become evident very quickly how much Harford County has been blessed over the years to have enjoyed the excellent volunteer service of our citizens who have provided these services for us all. Dedication doesn't come with a price.",What do you consider the greatest accomplishments and failings of the Glassman administration?,"Does Harford County have adequate resources to meet its needs, particularly in the funding of public schools and law enforcement?",Have the county’s land use policies adequately balanced growth and the preservation of existing communities and agricultural land?,"How do you rate the county’s efforts to fight opioid addiction overdoses? What else, if anything, should the county be doing to combat the epidemic?",How would you characterize the relationship between the Harford County Sheriff’s Office and the communities it serves? Are any reforms necessary?,The Glassman administration is trying to lead Harford County’s formerly all-volunteer fire and emergency medical services to more a professional organization with more paid personnel. How do you rate the county’s effort and what should have or could have done differently in this controversial transformation?,Glassman record,Taxes,Land use,Opioids,Sherrif's office,Fire/EMS
,YES,harford-county/county-council,B,Joe Woods,Woods,,,Fallston,Republican,Emergency Service and Public Safety leadership studies with National Board certifications.,"I have served in a number of Emergency Service and Public Safety leadership rolls on the local, state, and national levels. In Harford County I have served our Community since 1994 as a Volunteer Firefighter rising to the Office of Fire Chief. I was a Search and Rescue K9 handler and an Urban Search and Rescue search manager at the State level. On the National level I have served as a Firefighter with the Department of Defense and as an Emergency Manager being deployed with FEMA during the 2017 hurricane season. I am also a small business owner. My wife Laura and I started Maryland Quartermaster in 2011. Maryland Quartermaster is a police, military, and public safety supply store located in Fallston.",http://www.teamjoewoods.com,councilman.woods,,http://surveygizmoresponseuploads.s3.amazonaws.com/fileuploads/296249/4299906/95-57edb1702c6a440da66af0767796db00_s.jpg,I think Executive Glassman has done an excellent job and has many accomplishments.,"Yes, at this time.",Yes.,I think the county is doing a good job prioritizing efforts to solve this crisis.  We have been vigilant in providing financial resources and support.,"I think the relationship is very good and that the Sheriff's office does an outstanding job in our communities.  I believe there should be a greater appreciation and acknowledgement for the sacrifices, bravery and dedication of our law enforcement officers.",I think the County Executive has led this transition gracefully.  Change/transition is never easy and I think he has served the County well in this initiative.,What do you consider the greatest accomplishments and failings of the Glassman administration?,"Does Harford County have adequate resources to meet its needs, particularly in the funding of public schools and law enforcement?",Have the county’s land use policies adequately balanced growth and the preservation of existing communities and agricultural land?,"How do you rate the county’s efforts to fight opioid addiction overdoses? What else, if anything, should the county be doing to combat the epidemic?",How would you characterize the relationship between the Harford County Sheriff’s Office and the communities it serves? Are any reforms necessary?,The Glassman administration is trying to lead Harford County’s formerly all-volunteer fire and emergency medical services to more a professional organization with more paid personnel. How do you rate the county’s effort and what should have or could have done differently in this controversial transformation?,Glassman record,Taxes,Land use,Opioids,Sherrif's office,Fire/EMS
