general-only,survey-response,race,district,full-name,last-name,dob,,residence,party,education,background,web,social-fb,social-tw,headshot,a1,a2,a3,a4,a5,a6,q1,q2,q3,q4,q5,q6,sn1,sn2,sn3,sn4,sn5,sn6
,YES,harford-county/county-council,F,"Winifred ""Wini"" Roche",Roche,,,Havre de Grace,Democratic,Towson University Grad- B.S.  Mass Comm - 1994   Cambridge South-Dorchester  High Grad- 1987,"I have worked for 24 years as a tourism professional and business promoter. Most of this time I worked for local or county Government. For the past 3 years I have owned my own consulting firm and have consulted for the Maryland Tourism Coalition.   Dorchester County Tourism 9 years    * Founder of Sailwinds Park & Heritage Tourism effort in County Havre de Grace Office of Tourism 3 years*Creator of First Fridays Harford County Office of Economic Development 9 years  *Advocated for hotel tax and creation of Visit Harford, Inc. , LPGA Liaison, Coordinated successful County promotions such as Love it Campaign, Restaurant Week and Taste of Harford  Roche & Associates /MTC 3 years *Increased MTC membership,  raised profile of Maryland's tourism industry  and successfully lobbied for 1 million increase in state tourism Funding along with other state-wide tourism issues.",https://electwiniroche.com,,,http://surveygizmoresponseuploads.s3.amazonaws.com/fileuploads/296249/4299906/44-4b4e3714ecd490835aa6cc1b1df165ec_1a-LARGE-Roche-Wini18MF.jpg,"I would consider the greatest accomplishments of the Glassman administration the funding of the community schools for Havre de Grace which were desperately needed, finally enabling and implementing a hotel tax (after stalling it for years in Annapolis prior), and  taking a first step forward to fund school resource officers in middle and high schools.   The greatest failing would be the 2015 reorganization of the Office of Economic Development (not including the privatization of tourism which I support)  which included a   "" modern day approach"" to economic development by moving to rented  co-working space on Route 40 under the auspices of providing low cost space to  business start ups and County economic development professionals in a shared collaborative setting. The  approximate 12,000 square foot of space has been largely under utilized since this time and the office has just reorganized for a second time in 4 years.","There are currently not enough resources being allocated since MSDE reports an approximate 2 million shortfall annually in funding in recent years. Most importantly instructional salaries still lag behind comparable counties and we must bring those salaries up to a competitive level.  There remains a critical need for improvement in closing education gaps, expanding programs and services.   I would also like to see more support in schools for guidance counselors and the responsible use of technology and social media. The new program A Peaceful Alternative and peer to peer support groups are  a great step forward here.  I am an advocate for restorative programs to promote more community responsibility in our students. There is also a need for more vocational training and I would  support measures to build another technical school since there is a growing need for trade skills in our society.   More before and after care offered through the schools is a need in throughout the school system but particularly in District F.    I will also be a strong advocate for maintaining funding for music and drama programs. The move to fund school resource officers is a positive first step forward but additional funds will need to be identified to  adequately safe-guard ALL of our schools. This is a costly but necessary measure.","We need to continue to strive toward smart growth. There is a planned area in the County for development with public water and sewerage called the Development Envelope. This is a good concept and works to keep more intense housing and commercial zoning in designated areas while also helping to keep the rural character of the county intact. The 2016 Annual Growth Report shows Harford's current Development Envelope has enough empty land to build 16,953 new dwelling units (houses, apartments, etc.).  Up-zoning properties outside the Development Envelope hurts restoration and possible revitalization of existing, older areas as it is cheaper to build ""new"" on farmland rather than to renovate or replace existing buildings. In the 2017 CZR there is a combined potential loss of 168 acres of agricultural zoned property outside the Development Envelope.  We need to be mindful of the delicate balance between growth and quality of life remains an ongoing effort.","I am pleased with measures taken in the FY 19 budget to increase funding to the Mobile Crisis Team but we have a long way to go on this issue. We need to look at more intervention and support programs being available for people before they turn to opioids.  The County suffers from a lack of mental health providers for children. Many of the issues that cause people to turn to drugs could have been addressed through counseling or better coping abilities that can be taught when issues are identified in time. Every effort should be made to retain or attract more resources, especially physician providers to this area since teen depression, addiction, and suicide continues to be on the rise.","I would characterize this relationship as a work in progress like most communities across the country. Policing in this country has changed dramatically on a national scale over recent years and the narrative of abuse and racial intolerance vs. a growing disrespect for law enforcement  has and will definitely impact suburban communities like Harford County that serve such diverse populations.  The police -community relationship should begin early in the school system so that a trust between one another can be established and built on upon a neutral common ground. Like mutual respect in any relationship it (Respect) has to be earned over time. Adding trained school resource officers in all schools at the elementary level will go along way to improve this relationship. Sensitivity training should be taught to  law enforcement officers in regards to their communities. In turn, children should be taught that police officers and other people of authority should receive respect and to respond otherwise can be perceived as an act of aggression and can unnecessarily escalate situations.  As a daughter of a career law enforcement professional, I would like to foster this greater understanding so that all communities in Harford County can move forward together.","It is my understanding that the program currently in place is to supplement the volunteer efforts of our local fire companies and emergency medical services. Due to the increasing population call volume has increased which is requiring more services from volunteer personnel. I support this measure in its intent to ""test an idea"" and plan for the future sustainability of emergency response/care for County citizens.  The administration should strive for open lines of communication between these volunteer service providers to ensure that efforts are complimentary to what is being provided and not redundant as they test the effectiveness  of this  pilot program. Hopefully the new Emergency Medical Services Standards Advisory board  can establish performance measurements and evaluate  the cost effectiveness through data collection program while building upon the proud heritage and hard work  of our volunteer fire fighter and EMS community.",What do you consider the greatest accomplishments and failings of the Glassman administration?,"Does Harford County have adequate resources to meet its needs, particularly in the funding of public schools and law enforcement?",Have the county’s land use policies adequately balanced growth and the preservation of existing communities and agricultural land?,"How do you rate the county’s efforts to fight opioid addiction overdoses? What else, if anything, should the county be doing to combat the epidemic?",How would you characterize the relationship between the Harford County Sheriff’s Office and the communities it serves? Are any reforms necessary?,The Glassman administration is trying to lead Harford County’s formerly all-volunteer fire and emergency medical services to more a professional organization with more paid personnel. How do you rate the county’s effort and what should have or could have done differently in this controversial transformation?,Glassman record,Taxes,Land use,Opioids,Sherrif's office,Fire/EMS
,YES,harford-county/county-council,D,Jean M. Salvatore,Salvatore,,,Bel Air,Democratic,Bachelor's Degree in English Master's Degree in Administrative Science,"I am retired from Federal Service, spending most of my 34-year career at Aberdeen Proving Ground as a logistician and logistics chief.  I am an adjunct faculty member at Harford Community College and the founder and president of Best Friends in Harford County, an animal welfare non-profit organization.",,,,,"Mr. Glassman has restored some of the promised pay increases to Harford County teachers that the previous executive cut.  But there needs to be a stronger commitment from local government to both listen to and adequately resource the teachers and staff in our public schools.  Under Mr. Glassman, Harford has retained its agricultural heritage and rural areas , which is an aspect very many of us enjoy and appreciate  - open fields, farmers' markets, and walking trails.  I believe we need stronger leadership in planning for and ensuring a healthy, sustainable environment in the decades to come, to include strong protections for our streams, air,  and open spaces,  as well as growing ""green"" jobs in Harford that will help both the environment and the economy.","If we make schools and law enforcement priorities, I am certain we can resource them adequately.  Harford is fiscally sound, but where we direct funds depends on what citizens and their representatives in government feel are the most important issues to address.  The county could do a better job of including public comment to bills, including the budget, before they are voted on.  Notice of council and budget meetings could be better advertised to allow more interested residents to attend.","Agricultural preservation has local support, and the development envelope has been the designated ""growth zone"" for decades.  However, the county does not do an adequate job of giving notice of proposed development to allow public comments.  HarfordNEXT is a good step toward providing a way for residents to comment on future plans on a variety of topics, including development and open space, but it has not yet proven to be effective in influencing decisions and has not generated as much input as anticipated.  The county needs to offer residents more ways to be part of the process and create more interest in giving input to the policies and planning that will shape Harford's future for generations.","The opioid epidemic is a complex issue that all too many communities face today and needs health care experts to help provide solutions.  Addiction requires treatment, so every overdose incident should be followed up to ensure treatment, family counseling, and long-term monitoring are provided.  To be truly effective, rehabilitation needs to address not just addiction but related issues that could lead to relapse.  Suing drug manufacturers as a county may or may not be an effective tactic, but it will not address the current crisis.  We need education at all levels, in school and in the community, to recognize addiction and how to seek help for oneself and for others.  We also need health care providers to offer options for pain management other than opioids, including medical marijuana.","The Sheriff's Office has a good relationship with Harford communities in that their personnel are trusted to offer professional and timely service to residents in need.  Collective bargaining is long overdue, and that change will help to attract and retain highly professional deputies.","I have not followed the administration's proposal closely so will not give an opinion on this subject.  I believe the volunteer services are very good, but I think that a county of our size, with continued growth, should move to paid professional fire and EMS services.",What do you consider the greatest accomplishments and failings of the Glassman administration?,"Does Harford County have adequate resources to meet its needs, particularly in the funding of public schools and law enforcement?",Have the county’s land use policies adequately balanced growth and the preservation of existing communities and agricultural land?,"How do you rate the county’s efforts to fight opioid addiction overdoses? What else, if anything, should the county be doing to combat the epidemic?",How would you characterize the relationship between the Harford County Sheriff’s Office and the communities it serves? Are any reforms necessary?,The Glassman administration is trying to lead Harford County’s formerly all-volunteer fire and emergency medical services to more a professional organization with more paid personnel. How do you rate the county’s effort and what should have or could have done differently in this controversial transformation?,Glassman record,Taxes,Land use,Opioids,Sherrif's office,Fire/EMS
,YES,harford-county/county-council,D,Jerry Scarborough,Scarborough,,,Street,Republican,Graduated from Edgewood High School and one class of Criminal Justice at Harford Community College,Retired Maryland State Trooper and Business Owner for 26 years.,,,,http://surveygizmoresponseuploads.s3.amazonaws.com/fileuploads/296249/4299906/99-656f557219a6b3a589db7a7f60351972_13268335_10154281209988701_275489606747128042_o.jpg,The Non Transparency of this Administration bothers me.....Everything seems to be a secret.......Property and Buildings are being bought at 2-3 times it's appraisal.......Housing is out of control......Developments are popping up everywhere......We literally cannot move on our roadways.,The Harford County Executive received a 25% raise and the Harford County Council gave themselves an 18% raise while giving County Employees a 3% raise to be distributed over time.....Councilman Mike Perrone is the only councilman that voted against the raise...Teachers use their own funds to buy supplies to teach the children.....Harford County Sheriff's Dept. is a top notch department....The Deputies deserve more than they received.....,No...We are overgrown in Harford County....,I believe the Police Agencies are doing everything possible to take control of the Opioid Addiction but are at a loss.....As a retried Trooper I have never seen a drug problem as severe as this....Parenting at home is the answer to the epidemic....,Harford Countians respect the Harford County Sheriff's Dept.....This was obvious in February of 2016 when two Deputies gave their lives to protect others...,"The more developments we build,,,,the more we stress our Fire, EMS and Police Services.....Barry Glassman literally bought two ambulances and had no place to store them...It was like buying a horse and not having a barn to house the horse....It will cost Harford Countians a fortune if this Medic Service survives....It takes a minimum of 8 Paramedics per Ambulance.....I'm a Volunteer Fire Fighter....We already have ambulances and sometimes cannot get them out with a lack of volunteers.....We already have a paid Foundation Medics/Ems system.....Simply take the Paramedics and place them around Harford County Fire Houses where they are needed....Why buy more Ambulances when we already have them and they are mostly paid for?  It would also save tons of money because we wouldn't have to build Ambulance Facilities around the County.....Barry Glassman wants to become the next Governor and is trying to impress the future voters...",What do you consider the greatest accomplishments and failings of the Glassman administration?,"Does Harford County have adequate resources to meet its needs, particularly in the funding of public schools and law enforcement?",Have the county’s land use policies adequately balanced growth and the preservation of existing communities and agricultural land?,"How do you rate the county’s efforts to fight opioid addiction overdoses? What else, if anything, should the county be doing to combat the epidemic?",How would you characterize the relationship between the Harford County Sheriff’s Office and the communities it serves? Are any reforms necessary?,The Glassman administration is trying to lead Harford County’s formerly all-volunteer fire and emergency medical services to more a professional organization with more paid personnel. How do you rate the county’s effort and what should have or could have done differently in this controversial transformation?,Glassman record,Taxes,Land use,Opioids,Sherrif's office,Fire/EMS
,YES,harford-county/county-council,E,Diane L. Sengstacke,Sengstacke,7/11/1955,,Bel Air,Republican,"JD University of Baltimore; AA Paralegal studies Villa Julie College, n/k/a Stevenson University; BS General Studies Dance Core Towson State n/k/a Towson University","Attorney - Principal Member, Sengstacke & Evans, LLC; and President, Home Title Co. of Md., Inc.",,,,http://surveygizmoresponseuploads.s3.amazonaws.com/fileuploads/296249/4299906/95-709051fa7c4022faad81af2d0cd84b90_Head_Shot._LEO9497.jpg,"Glassman's Admin. accomplishments include 1. Fiscally responsible keeping the AAA Bond rating, giving a long time overdue pay raise to the teachers and police; 2. Bringing an upgrade in technology to H.Co. govt. from the snow truck tracker to online registration for lien certificates/permits; 3. helping to increase jobs and business development with grants & tax incentives, 4. working well with the Sheriff's department to increase the safety in H. Co.  We need to improve 1. increasing our culture, parks and rec programs & facilities, increase the local shopping , hotels & restaurants, tourism opportunities by funding events & capital projects in the county like funding the Maryland Center for the Arts, help the Havre de Grace Opera House, bring in events/concerts/sports events , help improve Cedar Lane fields and/or another venue to bring in sports tournaments and families (prevent them from going to other counties); use the Ripken Stadium, use the Arena Center at HCC, and other gems in our county 2. updating our infrastructure - roads/bridges/ water & sewer 3. funding the opioid crisis help, and 4. funding to employ more security resource officers at our schools.","No, we need more funding for our public schools and law enforcement. We need to work with the State and Federal government to increase the funding.  1. School safety is of utmost importance.  We need a trained person, Security Resource Officer (not the teachers) at every school or group of schools. We need cameras installed. We need a lock down system/practice drills in place if the need would ever arise. We may need to re-structure some of the open classroom schools for more security.  All of this is costly and needs to be properly budgeted.  Other sources of funding need to be investigated as well.  2. Besides school safety, I'd like to see increase funding for technology in our schools - use of the interactive ""blackboard"" in every classroom, laptops for the students to take to and from school for homework, increase communication between students and teachers. 3. I'd like to see increase funding for special programs and extra-curricula activities (sports/clubs/drama/music) , one in particular, is the ""middle college"" where high school students can take college courses and earn college credit at Harford Community College.","Yes, but we need to keep planning for the future.  We have just passed a new Master Plan that will help lead us with future growth.  The Harford Land Trust and State preservation programs help with land preservation of farms and large acreages of property.  But we need to be ready for future growth and not let it happen haphazardly. I think the millennial generation is ready to move out from their parents homes and basements.  They will be looking for affordable housing.  They will need townhomes, condominiums, apartments, and/or starter homes.  We want to provide them a place to live and raise their families in our County.  We need to help the builders/developers create the housing opportunities.  Lower the permitting fees, so that the costs are not passed through to the consumer.","We need to do more!!  We need to fight and destroy this epidemic.  It's killing our people.  We need to stop the supply and demand of the business - 1. catch and prosecute the drug distributions, create the laws to prosecute them for MURDER, strict sentencing for years (not catch and release) that will deter the gangs from coming into this county. But this is a statewide, national wide problem - we need to work with other jurisdictions too! 2. We need to work on the rehabilitation and treatment programs. Help fund them. Try to help the people get off the addiction. 3. Try to help people before they would ever start the drugs. I think this is a spiritual/psychological matter. We need to help churches and synagogues who give spiritual guidance.  I probably will be criticized for this, but I would like to see something in the schools. I would love to see prayer brought back to schools. Teach our children at a young age","The relationship of the Harford County Sheriff's Office and its communities is great! We are so very proud of our Sheriff and the deputies.  Sheriff Gahler speaks for us. He has been on the national news many times fighting for our rights, protection and safety.  He has spoken about the two deputies who tragically died a few years ago, to the opioid crisis, to school safety.","I grew up in Baltimore County where the fire and EMS personnel are paid by the County government. I think that will eventually happen in Harford County. But, I understand the controversy and that each local Harford County fire department wants to keep its own autonomy and control their own budget.  The local fire halls are concerned about keeping their money.  I think there should be collaboration between all concerned and work on a way to guide a transition. Communication is the key.  There should be meetings and talks set up with leaders from every fire hall with a professional mediator.  There is a lot to consider and everyone needs to understand the others point of view.  Perhaps a timeline for transition could be worked out.  There are benefits for having the County government  involved.",What do you consider the greatest accomplishments and failings of the Glassman administration?,"Does Harford County have adequate resources to meet its needs, particularly in the funding of public schools and law enforcement?",Have the county’s land use policies adequately balanced growth and the preservation of existing communities and agricultural land?,"How do you rate the county’s efforts to fight opioid addiction overdoses? What else, if anything, should the county be doing to combat the epidemic?",How would you characterize the relationship between the Harford County Sheriff’s Office and the communities it serves? Are any reforms necessary?,The Glassman administration is trying to lead Harford County’s formerly all-volunteer fire and emergency medical services to more a professional organization with more paid personnel. How do you rate the county’s effort and what should have or could have done differently in this controversial transformation?,Glassman record,Taxes,Land use,Opioids,Sherrif's office,Fire/EMS
